{
  "version": 1,
  "generated_at": "2026-05-20T08:31:45.763288+00:00",
  "schema": "docs/masterplan_status.schema.json",
  "authority": {
    "source_of_truth": "machine_artifacts",
    "manual_status_override_allowed": false,
    "rule": "Manuelle Statusaussagen duerfen maschinell erzeugten Status nicht ueberschreiben."
  },
  "inputs": {
    "m3a_release_candidate": {
      "path": "reports/m3a_release_candidate.json",
      "available": true,
      "error": null
    },
    "m4_release_candidate": {
      "path": "reports/m4_release_candidate.json",
      "available": true,
      "error": null
    },
    "frontend_truth": {
      "path": "reports/frontend_truth_report.json",
      "available": true,
      "error": null
    },
    "postgres_truth": {
      "path": "reports/postgres_truth_report.json",
      "available": true,
      "error": null
    },
    "gate_hierarchy": {
      "path": "reports/gate_hierarchy_result.json",
      "available": false,
      "error": "missing: H:\\WissenMai2026\\reports\\gate_hierarchy_result.json"
    },
    "gate_drift": {
      "path": "reports/gate_drift_report.json",
      "available": true,
      "error": null
    },
    "documentation_audit": {
      "path": "reports/documentation_release_audit.json",
      "available": true,
      "error": null
    },
    "known_limitations": {
      "path": "docs/known_limitations.json",
      "available": true,
      "error": null
    },
    "truth_marker_taxonomy": {
      "path": "reports/truth_marker_taxonomy.json",
      "available": true,
      "error": null
    }
  },
  "overall": {
    "status": "blocked",
    "progress_percent": 40.0,
    "release_allowed": false,
    "blocker_count": 22
  },
  "phases": {
    "m3a": {
      "id": "m3a",
      "label": "M3a Frontend Foundation",
      "status": "gate_passed",
      "decision": "GO",
      "score": 100.0,
      "source": "reports/m3a_release_candidate.json",
      "blockers": []
    },
    "m4": {
      "id": "m4",
      "label": "M4 Stabilization",
      "status": "tested",
      "decision": "NO_GO",
      "score": 86.96,
      "source": "reports/m4_release_candidate.json",
      "blockers": [
        {
          "id": "missing_m4_split_gate_reports",
          "severity": "blocking",
          "detail": "reports/m4a_auth_truth_report.json, reports/m4b_upload_queue_truth_report.json, reports/m4c_lifecycle_retrieval_truth_report.json, reports/m4e_backup_restore_truth_report.json and reports/m4_truth_report.json are not present."
        },
        {
          "id": "postgres_truth_m4_not_green",
          "severity": "blocking",
          "detail": "reports/postgres_truth_report.json is blocked: 120/138 passed, 16 failed, 2 errors, exit_code=1."
        },
        {
          "id": "m4b_truth_failure",
          "severity": "blocking",
          "detail": "tests/postgres_truth/test_m4_truth_flows.py::test_postgres_truth_recover_stale_import_job_retries_without_duplicate_rows failed and is M4b-critical."
        },
        {
          "id": "postgres_truth_setup_errors",
          "severity": "blocking",
          "detail": "reports/postgres_truth_report.json records 2 setup/collect errors; unclassified setup errors are gate-blocking until resolved."
        }
      ]
    },
    "m5": {
      "id": "m5",
      "label": "M5 Start",
      "status": "blocked",
      "decision": "NO_GO",
      "score": null,
      "source": "docs/known_limitations.json",
      "blockers": [
        {
          "id": "KL-M4-001",
          "severity": "blocking",
          "detail": "Der aktuelle PostgreSQL-Truth-Report ist nicht gruen: 138 collected, 120 passed, 16 failed, 2 errors, exit_code 1.",
          "source": "docs/known_limitations.json"
        },
        {
          "id": "KL-M4-003",
          "severity": "blocking",
          "detail": "PostgreSQL Truth enthaelt 2 Setup-/Collect-Errors; unklassifizierte Setup-Errors bleiben gate-blockierend.",
          "source": "docs/known_limitations.json"
        },
        {
          "id": "KL-M5-001",
          "severity": "blocking",
          "detail": "M5 Startgate bleibt blockiert, solange M4 Gesamtgate nicht PASS ist.",
          "source": "docs/known_limitations.json"
        },
        {
          "id": "KL-M5-002",
          "severity": "blocking",
          "detail": "Aktuelle PostgreSQL-Truth-Findings enthalten 15 M5 Entropy-/Drift-Failures.",
          "source": "docs/known_limitations.json"
        }
      ]
    },
    "governance": {
      "id": "governance",
      "label": "Operational Governance",
      "status": "blocked",
      "decision": "NO_GO",
      "score": null,
      "source": "docs/known_limitations.json",
      "blockers": [
        {
          "id": "KL-M5-001",
          "severity": "blocking",
          "detail": "M5 Startgate bleibt blockiert, solange M4 Gesamtgate nicht PASS ist.",
          "source": "docs/known_limitations.json"
        },
        {
          "id": "KL-M5-003",
          "severity": "blocking",
          "detail": "Operational Governance Gate darf erst nach M5 Startgate blockierend bewertet werden.",
          "source": "docs/known_limitations.json"
        }
      ]
    }
  },
  "gate_scores": {
    "m3a_gate": {
      "score": 100.0,
      "status": "gate_passed",
      "source": "reports/m3a_release_candidate.json"
    },
    "frontend_truth": {
      "score": 100.0,
      "source": "reports/frontend_truth_report.json"
    },
    "m4a_auth": {
      "score": 100.0,
      "status": "PARTIAL_PASS_BLOCKED_BY_M4_TRUTH",
      "source": "reports/m4_release_candidate.json"
    },
    "m4b_upload_queue": {
      "score": 91.7,
      "status": "PARTIAL_PASS_BLOCKED_BY_M4_TRUTH",
      "source": "reports/m4_release_candidate.json"
    },
    "m4c_lifecycle_retrieval": {
      "score": 100.0,
      "status": "PARTIAL_PASS_BLOCKED_BY_M4_TRUTH",
      "source": "reports/m4_release_candidate.json"
    },
    "m4_postgres_truth": {
      "score": 86.96,
      "collected": 138,
      "passed": 120,
      "failed": 16,
      "errors": 2,
      "exit_code": 1,
      "source": "reports/postgres_truth_report.json"
    }
  },
  "blockers": [
    {
      "phase": "m4",
      "id": "missing_m4_split_gate_reports",
      "severity": "blocking",
      "detail": "reports/m4a_auth_truth_report.json, reports/m4b_upload_queue_truth_report.json, reports/m4c_lifecycle_retrieval_truth_report.json, reports/m4e_backup_restore_truth_report.json and reports/m4_truth_report.json are not present.",
      "source": "reports/m4_release_candidate.json"
    },
    {
      "phase": "m4",
      "id": "postgres_truth_m4_not_green",
      "severity": "blocking",
      "detail": "reports/postgres_truth_report.json is blocked: 120/138 passed, 16 failed, 2 errors, exit_code=1.",
      "source": "reports/m4_release_candidate.json"
    },
    {
      "phase": "m4",
      "id": "m4b_truth_failure",
      "severity": "blocking",
      "detail": "tests/postgres_truth/test_m4_truth_flows.py::test_postgres_truth_recover_stale_import_job_retries_without_duplicate_rows failed and is M4b-critical.",
      "source": "reports/m4_release_candidate.json"
    },
    {
      "phase": "m4",
      "id": "postgres_truth_setup_errors",
      "severity": "blocking",
      "detail": "reports/postgres_truth_report.json records 2 setup/collect errors; unclassified setup errors are gate-blocking until resolved.",
      "source": "reports/m4_release_candidate.json"
    },
    {
      "phase": "m5",
      "id": "KL-M4-001",
      "severity": "blocking",
      "detail": "Der aktuelle PostgreSQL-Truth-Report ist nicht gruen: 138 collected, 120 passed, 16 failed, 2 errors, exit_code 1.",
      "source": "docs/known_limitations.json"
    },
    {
      "phase": "m5",
      "id": "KL-M4-003",
      "severity": "blocking",
      "detail": "PostgreSQL Truth enthaelt 2 Setup-/Collect-Errors; unklassifizierte Setup-Errors bleiben gate-blockierend.",
      "source": "docs/known_limitations.json"
    },
    {
      "phase": "m5",
      "id": "KL-M5-001",
      "severity": "blocking",
      "detail": "M5 Startgate bleibt blockiert, solange M4 Gesamtgate nicht PASS ist.",
      "source": "docs/known_limitations.json"
    },
    {
      "phase": "m5",
      "id": "KL-M5-002",
      "severity": "blocking",
      "detail": "Aktuelle PostgreSQL-Truth-Findings enthalten 15 M5 Entropy-/Drift-Failures.",
      "source": "docs/known_limitations.json"
    },
    {
      "phase": "governance",
      "id": "KL-M5-001",
      "severity": "blocking",
      "detail": "M5 Startgate bleibt blockiert, solange M4 Gesamtgate nicht PASS ist.",
      "source": "docs/known_limitations.json"
    },
    {
      "phase": "governance",
      "id": "KL-M5-003",
      "severity": "blocking",
      "detail": "Operational Governance Gate darf erst nach M5 Startgate blockierend bewertet werden.",
      "source": "docs/known_limitations.json"
    },
    {
      "phase": "M4",
      "id": "KL-M4-001",
      "severity": "blocking",
      "detail": "Der aktuelle PostgreSQL-Truth-Report ist nicht gruen: 138 collected, 120 passed, 16 failed, 2 errors, exit_code 1.",
      "blocked_gates": [
        "m4_overall_gate",
        "m5_start_gate"
      ],
      "source": "docs/known_limitations.json"
    },
    {
      "phase": "M4b",
      "id": "KL-M4-002",
      "severity": "blocking",
      "detail": "M4b-kritischer Truth-Test fuer stale import job recovery ist rot.",
      "blocked_gates": [
        "m4b_gate",
        "m4_overall_gate"
      ],
      "source": "docs/known_limitations.json"
    },
    {
      "phase": "M4",
      "id": "KL-M4-003",
      "severity": "blocking",
      "detail": "PostgreSQL Truth enthaelt 2 Setup-/Collect-Errors; unklassifizierte Setup-Errors bleiben gate-blockierend.",
      "blocked_gates": [
        "m4_overall_gate",
        "m5_start_gate"
      ],
      "source": "docs/known_limitations.json"
    },
    {
      "phase": "M4",
      "id": "KL-M4-004",